[
  {
    "kind": "youtube#playlistItemListResponse",
    "etag": "K2q9kpGFc8MFscw9bu7ZiukS2Hc",
    "items": [
      {
        "kind": "youtube#playlistItem",
        "etag": "Lt3779X_kPPFXIYrLqwT1rLsZmE",
        "id": "VVU0UW9iVTZTVEZCMFA3MVBNdk9HTjVBLmpOUVhBQzlJVlJ3",
        "snippet": {
          "publishedAt": "2005-04-24T03:31:52Z",
          "channelId": "UC4QobU6STFB0P71PMvOGN5A",
          "title": "Me at the zoo",
          "description": "Microplastics are accumulating in human brains at an alarming rate\nhttps://www.youtube.com/watch?v=0PT5c1z3LL8\n\n\u201cNanoplastics and Human Health\u201d with Matthew J Campen, PhD, MSPH\nhttps://www.youtube.com/watch?v=RRBN_4L09Mg\n\n00:00 Intro\n00:05 The cool thing\n00:17 End",
          "thumbnails": {
            "default": {
              "url": "https://i.ytimg.com/vi/jNQXAC9IVRw/default.jpg",
              "width": 120,
              "height": 90
            },
            "medium": {
              "url": "https://i.ytimg.com/vi/jNQXAC9IVRw/mqdefault.jpg",
              "width": 320,
              "height": 180
            },
            "high": {
              "url": "https://i.ytimg.com/vi/jNQXAC9IVRw/hqdefault.jpg",
              "width": 480,
              "height": 360
            }
          },
          "channelTitle": "jawed",
          "playlistId": "UU4QobU6STFB0P71PMvOGN5A",
          "position": 0,
          "resourceId": {
            "kind": "youtube#video",
            "videoId": "jNQXAC9IVRw"
          },
          "videoOwnerChannelTitle": "jawed",
          "videoOwnerChannelId": "UC4QobU6STFB0P71PMvOGN5A"
        },
        "contentDetails": {
          "videoId": "jNQXAC9IVRw",
          "videoPublishedAt": "2005-04-24T03:31:52Z"
        },
        "status": {
          "privacyStatus": "public"
        }
      }
    ],
    "pageInfo": {
      "totalResults": 1,
      "resultsPerPage": 50
    }
  }
]
