{
  "kind": "youtube#playlistItemListResponse",
  "etag": "RFt0OTmmB44u1uLeHIFuiqR27as",
  "nextPageToken": "EAAaHlBUOkNBSWlFREk0T1VZMFFUUTJSRVl3UVRNd1JESQ",
  "items": [
    {
      "kind": "youtube#playlistItem",
      "etag": "Lr5MBZwVL-oXsga3aB2m46Nb12U",
      "id": "UEx1aGw5VG5RUERDbldJaHlfS1NidEZ3WFZRbk52Z2ZTaC41MjE1MkI0OTQ2QzJGNzNG",
      "snippet": {
        "publishedAt": "2025-01-24T07:50:11Z",
        "channelId": "UC4QobU6STFB0P71PMvOGN5A",
        "title": "How YouTube Was Created ft. Founder Steve Chen",
        "description": "This episode takes us back to the earliest days of YouTube, as the founders explain why it was a longshot that succeeded against all odds. When cofounders Steve Chen, Chad Hurley and Jawed Karim left PayPal to start YouTube, it wasn\u2019t even clear that the nascent broadband infrastructure could support playing video in a browser. In a brief period until its acquisition by Google\u2014from its first incarnation as a video dating site to confronting daunting technical and legal challenges\u2014the early story of YouTube is an underdog tale of scrappy upstarts who ended up changing the world. \n\nHost: Roelof Botha, Sequoia Capital\nFeaturing: Steve Chen, Jawed Karim, Zahavah Levine, Colin Corbett, Yu Pan\n\nLearn more: https://www.cruciblemoments.com/episodes/youtube\n\n00:00 - Introduction\n02:23 - From PayPal to YouTube: The Genesis of a Digital Revolution\n05:24 - Solving the Online Video Challenge in 2005\n07:01 - From Dating Site to Video Sharing Platform\n09:11 - Overcoming Crickets to Sparking YouTube\u2019s Network Effect\n11:39 - How MySpace and Viral Clips Fueled YouTube\u2019s Early Growth\n14:17 - Securing Funding and Entering the Spotlight: YouTube\u2019s Rise in 2005\n16:05 - Scaling YouTube Amid Explosive Growth and Viral Success\n19:44 - YouTube\u2019s Shift to In-House Infrastructure\n21:35 - How YouTube Tackled Infrastructure Challenges \n23:51 - YouTube\u2019s Journey to Balancing Ads and Copyright Challenges\n28:48 - YouTube\u2019s Turning Point in the Fight for Copyright Agreements\n32:24 - The Pivotal Decision to Partner with Google\n35:25 - The Secretive Sale of YouTube to Google\n38:17 - The Acquisition That Secured YouTube\u2019s Future\n41:13 - Content ID: Cementing YouTube\u2019s Future with Copyright Holders\n43:10 - Building the Creator Economy and a Global Legacy",
        "thumbnails": {
          "default": {
            "url": "https://i.ytimg.com/vi/lVI_J1cbFb4/default.jpg",
            "width": 120,
            "height": 90
          },
          "medium": {
            "url": "https://i.ytimg.com/vi/lVI_J1cbFb4/mqdefault.jpg",
            "width": 320,
            "height": 180
          },
          "high": {
            "url": "https://i.ytimg.com/vi/lVI_J1cbFb4/hqdefault.jpg",
            "width": 480,
            "height": 360
          },
          "standard": {
            "url": "https://i.ytimg.com/vi/lVI_J1cbFb4/sddefault.jpg",
            "width": 640,
            "height": 480
          },
          "maxres": {
            "url": "https://i.ytimg.com/vi/lVI_J1cbFb4/maxresdefault.jpg",
            "width": 1280,
            "height": 720
          }
        },
        "channelTitle": "jawed",
        "playlistId": "PLuhl9TnQPDCnWIhy_KSbtFwXVQnNvgfSh",
        "position": 0,
        "resourceId": {
          "kind": "youtube#video",
          "videoId": "lVI_J1cbFb4"
        },
        "videoOwnerChannelTitle": "Sequoia Capital",
        "videoOwnerChannelId": "UCWrF0oN6unbXrWsTN7RctTw"
      },
      "contentDetails": {
        "videoId": "lVI_J1cbFb4",
        "videoPublishedAt": "2024-12-05T10:00:50Z"
      },
      "status": {
        "privacyStatus": "public"
      }
    },
    {
      "kind": "youtube#playlistItem",
      "etag": "48SdJl2f_Psbxp6cry5TvoTkQ8o",
      "id": "UEx1aGw5VG5RUERDbldJaHlfS1NidEZ3WFZRbk52Z2ZTaC41NkI0NEY2RDEwNTU3Q0M2",
      "snippet": {
        "publishedAt": "2020-04-28T07:33:20Z",
        "channelId": "UC4QobU6STFB0P71PMvOGN5A",
        "title": "r | p 2006: YouTube: From Concept to Hypergrowth - Jawed Karim",
        "description": "Less than two years after launch, YouTube has become one the most-visited destinations on the web. With more than 100 million videos served daily, it may be the fastest-growing entertainment website in the history of the World Wide Web. Jawed Karim will explain the thought process and the events that led to the development of YouTube.\n\nJawed Karim is the co-founder of the popular video sharing website YouTube. Karim attended the University of Illinois from 1997 until 2000, when he joined PayPal to become one of its first developers. He completed his remaining credits at UofI by correspondence and received a B.S. in CS in 2004. In 2005 Karim co-founded YouTube with two friends, co-developing the concept and product, and raising money from Sequoia Capital. He subsequently acted as an advisor to the company and is a graduate student in computer science at Stanford University and an investor in early-stage startups.\nJawed has a long history with ACM and Reflections Projections at UIUC. As a student in 1998, he presented a conference talk, \"Practical Graphics Programming,\" and in 1999, his team placed 2nd in MechMania.\nFor more information, please visit www.jawed.com.",
        "thumbnails": {
          "default": {
            "url": "https://i.ytimg.com/vi/XAJEXUNmP5M/default.jpg",
            "width": 120,
            "height": 90
          },
          "medium": {
            "url": "https://i.ytimg.com/vi/XAJEXUNmP5M/mqdefault.jpg",
            "width": 320,
            "height": 180
          },
          "high": {
            "url": "https://i.ytimg.com/vi/XAJEXUNmP5M/hqdefault.jpg",
            "width": 480,
            "height": 360
          },
          "standard": {
            "url": "https://i.ytimg.com/vi/XAJEXUNmP5M/sddefault.jpg",
            "width": 640,
            "height": 480
          },
          "maxres": {
            "url": "https://i.ytimg.com/vi/XAJEXUNmP5M/maxresdefault.jpg",
            "width": 1280,
            "height": 720
          }
        },
        "channelTitle": "jawed",
        "playlistId": "PLuhl9TnQPDCnWIhy_KSbtFwXVQnNvgfSh",
        "position": 1,
        "resourceId": {
          "kind": "youtube#video",
          "videoId": "XAJEXUNmP5M"
        },
        "videoOwnerChannelTitle": "Reflections Projections",
        "videoOwnerChannelId": "UCm5h-rixlNgYL1PoFPJjYog"
      },
      "contentDetails": {
        "videoId": "XAJEXUNmP5M",
        "videoPublishedAt": "2013-04-23T03:46:50Z"
      },
      "status": {
        "privacyStatus": "public"
      }
    }
  ],
  "pageInfo": {
    "totalResults": 4,
    "resultsPerPage": 2
  }
}